{
  "$schema": "https://json-schema.org/draft/2020-12/schema",
  "$id": "https://hybrid-dt-framework/contracts/datasource.schema.json",
  "title": "DataSource Descriptor",
  "description": "F7 (REQ-701~702): 데이터 소스 인스턴스 선언. 코어는 이 디스크립터만 알고 특정 관측 스택 구현에 의존하지 않는다(NFR-005). Prometheus는 첫 구현체일 뿐이며 type 값 하나로 교체 가능하다.",
  "type": "object",
  "required": ["id", "type", "version", "capabilities"],
  "additionalProperties": false,
  "properties": {
    "id": {
      "type": "string",
      "pattern": "^[a-z0-9][a-z0-9-]*[a-z0-9]$",
      "description": "데이터 소스 인스턴스 식별자. Pipeline(F4) source 노드의 dataSourceRef가 이 값을 참조한다."
    },
    "type": {
      "type": "string",
      "pattern": "^[a-z0-9][a-z0-9-]*[a-z0-9]$",
      "description": "구현체 타입 키. REQ-702에 따라 prometheus를 첫 구현체로 제공한다. 코어는 이 값을 레지스트리 조회 키로만 사용하므로 enum으로 닫지 않는다."
    },
    "version": {
      "type": "string",
      "pattern": "^\\d+\\.\\d+\\.\\d+$"
    },
    "displayName": {
      "type": "string"
    },
    "description": {
      "type": "string"
    },
    "endpoint": {
      "type": "string",
      "description": "접속 주소. 구현체별 해석(HTTP URL, gRPC 대상 등)에 위임한다."
    },
    "capabilities": {
      "type": "object",
      "required": ["instantQuery", "rangeQuery", "streaming"],
      "additionalProperties": false,
      "description": "이 소스가 지원하는 질의 방식. F8 validator가 파이프라인 source 노드의 queryMode와 대조해 미지원 조합을 사전에 차단한다.",
      "properties": {
        "instantQuery": {
          "type": "boolean",
          "description": "단일 시점 값 조회 지원 여부."
        },
        "rangeQuery": {
          "type": "boolean",
          "description": "시간 구간 조회 지원 여부(그래프 렌더러 등에 필요)."
        },
        "streaming": {
          "type": "boolean",
          "description": "지속 구독(push) 지원 여부. false면 폴링으로만 동작한다."
        }
      }
    },
    "auth": {
      "type": "object",
      "additionalProperties": false,
      "description": "인증 설정. 자격 증명 값 자체는 절대 이 디스크립터에 기록하지 않으며, 외부 시크릿 저장소 참조만 허용한다.",
      "required": ["mode"],
      "properties": {
        "mode": {
          "type": "string",
          "enum": ["none", "basic", "bearer", "mtls"]
        },
        "secretRef": {
          "type": "string",
          "description": "시크릿 저장소의 참조 키. mode가 none이 아니면 필수."
        }
      },
      "allOf": [
        {
          "if": {
            "properties": { "mode": { "not": { "const": "none" } } },
            "required": ["mode"]
          },
          "then": { "required": ["secretRef"] }
        }
      ]
    },
    "defaultTimeoutMs": {
      "type": "integer",
      "minimum": 1,
      "default": 5000,
      "description": "질의 타임아웃 기본값. 파이프라인 source 노드에서 개별 재정의 가능."
    },
    "labels": {
      "type": "object",
      "description": "운영용 자유 메타데이터(환경 구분 등). 코어 로직은 이 값을 해석하지 않는다.",
      "additionalProperties": { "type": "string" }
    }
  }
}
